{
  "schemaVersion": "1",
  "id": "framework-v1-smoke",
  "frameworks": [ "lakona", "pinus" ],
  "workloads": [ "frontdoor.echo", "cluster.direct", "cluster.routed" ],
  "payloadSizes": [ 32 ],
  "concurrency": [ 16 ],
  "seed": 20260715,
  "timing": {
    "startupTimeoutMilliseconds": 60000,
    "readinessTimeoutMilliseconds": 60000,
    "warmupMilliseconds": 2000,
    "measurementMilliseconds": 5000,
    "requestTimeoutMilliseconds": 5000,
    "drainTimeoutMilliseconds": 5000,
    "shutdownTimeoutMilliseconds": 5000
  },
  "histogram": {
    "unit": "microseconds",
    "lowestDiscernibleValue": 1,
    "highestTrackableValue": 60000000,
    "significantDigits": 3
  }
}
