{
  "schemaVersion": "1",
  "id": "framework-v1-echo-conformance",
  "frameworks": [ "lakona", "pinus" ],
  "workloads": [ "frontdoor.echo" ],
  "payloadSizes": [ 32, 256 ],
  "concurrency": [ 4 ],
  "seed": 20260715,
  "timing": {
    "startupTimeoutMilliseconds": 60000,
    "readinessTimeoutMilliseconds": 60000,
    "warmupMilliseconds": 100,
    "measurementMilliseconds": 500,
    "requestTimeoutMilliseconds": 2000,
    "drainTimeoutMilliseconds": 2000,
    "shutdownTimeoutMilliseconds": 5000
  },
  "histogram": {
    "unit": "microseconds",
    "lowestDiscernibleValue": 1,
    "highestTrackableValue": 60000000,
    "significantDigits": 3
  }
}
